{"artifact":{"byte_length":3757,"path":"pipeline/v4_2/memos/v42_c2d98b424aa61ca1c8b8c259_a1.md","sha256":"a6dfd96c97c86f3684e09f3feff5bd3ef4216456ba610cff2f5a798ffade5c63"},"artifact_kind":"memo","authorized_commit_sha":"8de38c5aa9437e77beb696e46099c02a960b242e","authorized_task_path":"/root/finalize_v4_2_c2d98b424aa61ca1c8b8c259_a1","campaign_id":"v42-regression-20260721-freeze8","claim_receipt_version":"v4.2-output-claim-receipt-1","entry_id":"entry_v42_c2d98b424aa61ca1c8b8c259_a1","execution":{"codex_task_path":"/root/finalize_v4_2_c2d98b424aa61ca1c8b8c259_a1","fork_policy":"none","issued_by_task_path":"/root","role":"finalizer"},"execution_envelope":{"byte_length":1351,"path":"pipeline/v4_2/envelopes/v42_c2d98b424aa61ca1c8b8c259_a1.json","sha256":"239edf8ba3d0c0d9f59251acb6c2bb58cac9e0f4c8e9bd928d90e48376d666d7"},"freeze_root_sha256":"1f1fedba7760aad8f4589d40d0f984c7d73359557f3839efa4c2104dc0a475a2","plan":{"path":"pipeline/v4_2/issuance/v42-regression-20260721-freeze8.json","plan_sha256":"9c90d3fc49449053c7050f4dc576ee3fabfe05999fd43cff14b36551824ac50a","sha256":"2f1e4e851ec584b4bcab086864c8e222df194b24ab91ee295b6f4df526a4b79b"},"reservation":{"byte_length":652,"claim_receipt_path":"pipeline/v4_2/memos/v42_c2d98b424aa61ca1c8b8c259_a1.md.claim-receipt.json","claim_token_sha256":"c0b0b513cc694f24df82ea7aefc564b933426f1ae31029b6ee65a76820269770","lock_path":"pipeline/v4_2/memos/v42_c2d98b424aa61ca1c8b8c259_a1.md.claim.lock","path":"pipeline/v4_2/memos/v42_c2d98b424aa61ca1c8b8c259_a1.md.reservation.json","sha256":"0b5da05e98a5eb2b99511c08f306e4e39f5bb71d7b4defcee7e5459ad11bd002"},"run_id":"v42_c2d98b424aa61ca1c8b8c259_a1"}